NR,Rolle,Firma,Typ,Aussage,Cluster,Beschreibung
9,Chief Data Officer,Wirtschaftsprüfung,Beratung,"Dann geht es eben darum, wie viele Kosten kann ich da sparen, wobei das ist Augenwischerei, dass wir das überhaupt quantifizieren können, also ich glaube, das ist ja auch immer so ein Thema, wie quantifiziere ich das, das ist so abhängig von wie viele Daten ich habe, wie viele Tools ich habe, welche sind zentral, welche nicht, also ich kann jetzt nicht sagen, ja gut, mach EDM verspasst eine Million, das wäre gelogen, aber man kann schon viel sparen mit sowas.

Das muss man durchrechnen und da kann ich jetzt nicht sagen, ich bin jetzt hier der Guru und zahle 200.000 oder 100.000 in einem Jahr, das sind so die Aussagen und ich weiss, für jeden Manager und für jeden C- Level-Exekutiv ist die Aussage nicht attraktiv, vor allem nicht, wenn man auf Short-Term- Benefits aussieht, dann ist das das falsche Thema.",keine Hard Savings gemessen ,-
9,Chief Data Officer,Wirtschaftsprüfung,Beratung,langfristige Kostenersparniss keine kurzfristige,keine kurzfristige Hard Savings,-
9,Chief Data Officer,Wirtschaftsprüfung,Beratung,"Genau, also wir haben ja jetzt eigentlich nur die Kosten besprochen, Opportunitäten sind eben, ich kann dann anfangen mit Data-Driven-Services, je nachdem was ich für Daten
habe, gerade Unternehmen wie meins, wir sitzen auf unheimlich vielen Daten, die für sehr viele verschiedene Use-Cases genutzt werden könnten, insofern erlaubt, insofern möglich und genau da sind dann halt auch Effekte im Spiel, die ich gar nicht gut berechnen kann, also wer kauft denn das am Schluss, vielleicht viele, vielleicht niemand, das ist noch nicht so ganz klar und das ist dann nochmal ein ganz anderes Thema, also da kann man auch noch viel Zusatzeinkommen generieren, wenn man auf vielen Daten sitzt.",Steigerung Wertschöpfung,Zusatzeinkommen durch besseren Überblick der Daten + Data Driven Services
9,Chief Data Officer,Wirtschaftsprüfung,Beratung,"Wenn mein Unternehmen datengetrieben ist und viel mit Daten arbeitet, ist der Nutzen
eher auf 4 bis 5 einzuordnen, weil dann habe ich wirklich alles unter Kontrolle, wenn ich das
sauber mache, sobald ich nicht datengetrieben bin, ist der Nutzen fast bei 0, also es ist
wirklich das eine Extrem oder das andere Extrem, das ist so ein bisschen das Nutzenthema,
aber eben es ist unheimlich schwierig zu sagen, weil es kann dann auch sein,",Skala 1-5  Hard Savings durch EDM ,Nutzen EDC EDM 4/5 für Datengetriebene Unternehmen
9,Chief Data Officer,Wirtschaftsprüfung,Beratung,"""Wenn mein Unternehmen datengetrieben ist und viel mit Daten arbeitet, ist der Nutzen
eher auf 4 bis 5 einzuordnen, weil dann habe ich wirklich alles unter Kontrolle, wenn ich das
sauber mache, sobald ich nicht datengetrieben bin, ist der Nutzen fast bei 0, also es ist
wirklich das eine Extrem oder das andere Extrem, das ist so ein bisschen das Nutzenthema,
aber eben es ist unheimlich schwierig zu sagen, weil es kann dann auch sein,""",Skala 1-5  Hard Savings durch EDM ,Nutzen EDC EDM 1/5 für nicht Datengetriebene Unternehmen
27,Data Steward,Bank,Externe Firma,"But think of, for instance, if you know that the column ABC means this and everybody knows
that the column ABC means this, you're not going to have any minute of discussion on what
it means.

 So if you had a meeting of five people, half an hour to discuss that, you saved 30 minutes
of salary of all those five people, for instance, starting from there. But probably, yeah, there
are other, yeah, savings. ",Reduktion Personalaufwand,-
27,Data Steward,Bank,Externe Firma,"That is a huge gain, of course, because if you know which datasets that you have in the
company, you search for them in the data catalog, and then you ask for access.I nstead of buying again, ",Vermeidung teurer Daten-Duplikate ,-
10,Data Executive,Versicherungsfirma,Collibra Success Story,"So we didn't really have any hard measures as to what the cost savings are, but definitely
compliance is one of them. And the ability to respond to audits very, very quickly definitely
saves us time. But I don't think we measured the cost savings in numbers or dollars anyway",Kostenreduktion in Compliance,-
1,Chief Data Officer,Globaler Brauereikonzern,Collibra Success Story,"And you see how much time data scientists are wasting, how much time is wasted on deciding. So then you create a complete mess that almost like paralyzes your operations. And it's almost like the cost of not doing that is very high. 

Your time of the data scientists don't find anything.",Reduktion Zeitaufwand,-
1,Chief Data Officer,Globaler Brauereikonzern,Collibra Success Story,"But the other thing, you will get fines. And those fines can be quite hefty, particularly if you're putting consumer data with no restriction and no order, etc. Because you have the right to be forgotten, you have the right for deletion, you have certain policy, you need to delete things every six months, etc., etc. So you see kind of the potential costs are growing very quickly. In certain jurisdictions now, they're taking a very strong stance that's outside Europe, not in
Europe. Europe has got fines, which is fine. You can just say, well, I just pay the fines.",Prozeskosten,-
1,Chief Data Officer,Globaler Brauereikonzern,Collibra Success Story,"No one knew what it was. So what happened is that everyone was just trying. It was almost like a discovery, just literally like you are in these dumps that you see in the slums of some
of the cities and everyone just find it.
Then everyone would duplicate the same data sets in 10,000 places. And then your cloud
costs will skyrocket because you have the same data set in 50 places. So again, there is a
colleague of mine who's got this muscle.",hohe Kosten wegen falschen Daten ,-
1,Chief Data Officer,Globaler Brauereikonzern,Collibra Success Story,"Then you can calculate very easily what is the annual cost of that cloud credit, and you say, okay, well, if I have ordered these costs, I'm not dealing with, but this is very specific for any
organization. So to an extent, it depends on the existing mess. If the existing mess is a lot,
then you can say, oh, yeah, I'm saving like millions, but I cannot tell you a number that is
true in every situation, right?",Reduktion Cloudkosten ,"Einsparungen im Millionen Bereich, wenn man eine grosse Firma ist, 
mit einem grossen Mess in den Daten"
1,Chief Data Officer,Globaler Brauereikonzern,Collibra Success Story,"No, let's assume that you have only 5% of reports, reports being KPIs, dashboards, stuff that is unused. And maybe your total number of reports is very small. Then the business case for Collibra is very low, because maybe that total cloud value of that 5% is, I don't know what, maybe 10,000 pounds per year. In our case, we were sitting on 36,000 reports enacted. There were millions in cloud savings just by having better governance, because we had stuff that no one knew that was even existing, were thrown into cloud. We didn't know what it was. Then you could see immediately a reduced consumption in cloud credits, and then it was immediate, and it was great.",Reduktion Cloudkosten ,"5% weniger Duplikation --> von 36'000 Reports --> 
Millionen in cloud savings "
1,Chief Data Officer,Globaler Brauereikonzern,Collibra Success Story," Again, so the large company, large mess, five.
Small company, small mess, one.",Skala 1-5  Hard Savings durch EDM ,ROI EDM EDC 5/5 für Firmen mit grossem Mess
1,Chief Data Officer,Globaler Brauereikonzern,Collibra Success Story,"Large company, well, really difficult. So the only way that you can survive is that you can,
you continue to put more bodies at it. Yeah, so you would have these centers in local
locations, and you move from 100, 1000, then you have all these people doing excels and
stuff like that",Reduktion Personalaufwand,-
31,Professor,IT Management,Univesität,"Wenn ich aber jetzt ein gewachsenes Unternehmen bin, beispielsweise hatten wir miteinem großen OEM zusammengearbeitet, also Car Manufacturing, die hatten 600 Systeme.
Und da unterschiedliche Daten in unterschiedlicher Qualität, in unterschiedlichenStrukturen abgelegt.Und dann hast du natürlich massive Einsparpotenziale, erstmal diese Transparenz zuschaffen, die Daten einheitlich so verfügbar zu machen, dass du sie analysieren kannst unddamit dann einen Mehrwert generieren kannst.",Steigerung Wertschöpfung,Einsparungspotenziale durch Datenverfügbarkeit und Möglichkeit zur Analyse 
31,Professor,IT Management,Univesität,"weil umso besser die Datengrundlage ist und vorliegt, umso besser kannst du auch Forecastings machen, Belegungspläne machen. Ressourcen effektiv ausnutzen, sodass Wartezeiten verringert werden, hat riesige Implikationen. Wirtschaftliche Unternehmen, je nach Use Case natürlich auch.  Ich glaube allein, dass ich die Accuracy in meinem Reporting besser hinbekomme. Oder wenn ich Daten am Ende irgendwie End-zu-Ende verfügbar habe, dann kann ich ja nicht nur statisch einfach nur reporten, also Vergangenheitsanalysen, sondern ich kann auch Simulationen machen und dann auch besser forecasten, wie ich meine Produktionslandschaft beispielsweise aufstellen soll oder you name it. Dadurch, dass es sich um Daten handelt, ist glaube ich auch die Vielfalt der Use Cases, die du damit machen kannst, indem du halt die Qualität und die Strukturen und die Ownerships und vielleicht auch Data Products dann besser zur Verfügung stellst.",Steigerung Wertschöpfung,Business Case  durch bessere Forecastings 
31,Professor,IT Management,Univesität,"Eine 4, aber ich meine, am Ende ist das, weißt du, das ist Baseline,
Architekturgeschäft. Wenn du das nicht hast, kannst du, das ist also eine Necessary
Condition. Ohne das geht ganz, ganz viele andere Sachen nicht.Das ist eine Pre-Condition. Für mich muss das jedes Unternehmen machen, das irgendeinen
Mehrwert aus Daten ziehen möchte.",Skala 1-5  Hard Savings durch EDM ,ROI EDM/EDC 4/5
3,Experte,Collibra,EDM / EDC Anbieter,"I'll give you another example, a very simple example that I was working with a bank and they had about, I think,
10,000 or 11,000, like a lot of code sets. Now they were getting this from Experian, they were getting it from different credit organizations and other things, right? But what they found after they brought that into Collibra was that some of those were almost the same, but they were paid separately. They were paying separately to Experian or whatever it is, right? And some of them are very similar with very small differences, right? So what they did was that they managed to bring down the number of code values and code sets from 11,000 to, I think, to about 7,000 or 8,000. So that's a huge, that's a huge saving because they're not paying anymore for whatever that was. So those things are practical things that can happen that would immediately show value, right? Because you can say, now we've reduced the number of code sets and previously we were paying $10 million, now we're only paying $4 or $5 or whatever it is, right?",Vermeidung teurer Daten-Duplikate ,"11'000 code sets (Data) reduced to 7000 --> mussten nur noch 
für 7000 Sets bezahlen, weil 4'000 ähnlich waren. --> vorher 10 Millionen für Code Sets bezahlt und nachher 4-5 Milllionen"
3,Experte,Collibra,EDM / EDC Anbieter,"And the consequence is not immediately obvious. Right. Things start to fail after, it will take
time to fail, but when they do, it will be catastrophic.Right. But until that happens, it's not going to, you know, so one of the things, not doing it is that depending on, obviously dependent on the sector, fines, large fines could happen. Right. We have a customer who came to us just because they got fined and they had to implement a data program. They got fined and some people died.

The other one could be simply that you cannot compete with companies
that are now coming up with faster, quicker turnaround times. Because if you don't know
where your data is, if you don't understand what it means, and if you can't trust it, you can't
do quick things compared to other companies who are in that program, understand what
something means.",Cost of Doing Nothing,-
11,Experte,Collibra,EDM / EDC Anbieter,"Beispielsweise typische Produktivitätssteigerungen im Data Governance Bereich, wenn ich die Zahlen nicht richtig im Kopf habe, liegen so bei 13 bis 15 Prozent. Jetzt überlegen wir mal,
da sind 500 Leute damit beschäftigt. Die sparen 15 Prozent ihres Aufwandes für Datenmanagement ein. Da reden wir über Millionen Savings. So, also das ist das Erste. Automatisierung, Produktivitätssteigerung.",Steigerung Wertschöpfung,"Kosten durch Produktivitätssteigerungen in Data Governance: 13 - 15% Reduktion Aufwand --> bei ca. 500 Personen, Einsparungen
von Millionen"
11,Experte,Collibra,EDM / EDC Anbieter,"Collibra steigert die Produktivität im Datenmanagement durch Automatisierung, was besonders bei großen Teams zu enormen Zeit- und Kosteneinsparungen führt.",Reduktion Zeitaufwand,-
12,Chief Operations Officer,Handelsunternehmen,Externe Firma,"Bei der Bildung von Paletten muss man sicherstellen, dass die Reihenfolge, wie die Palette gebildet wird, ungefähr der Reihenfolge entspricht, wie sie auch wieder auseinandergenommen wird in der Filiale. Sprich, man versucht ein Filial-Layout darzustellen und wenn man das Ganze dann macht und die Palette sehr kompakt wird, dann kann man Transportkosten einsparen. Aus diesen verschiedenen Faktoren heraus gibt es unendlich viele Kombinationen. Dann hat man auf der einen Seite 5.500 Artikel, auf der anderen Seite 700-800 Filialen und alle Kombinationen. Jetzt kann man relativ grob sagen, mach die Getränke unten und mach die Chips oben, der Mensch kann nach 80-20 eine Lösung finden, die ganz okay ist. Aber jetzt muss man mit Daten zu arbeiten beginnen und es reicht eben nicht einfach nur Volumendaten zu haben, die ungefähr stimmen, sondern sie müssen sehr präzise sein. Dann braucht man weitere Datenattribute, wie stabil ist eine Chipsverpackung effektiv und wie sehen die Filialen aus. Das muss man irgendwie in ein Datenmodell bringen. Dort haben wir einfach mit einem besseren Optimierungsalgorithmus einige Prozent rausgeholt an Paletten, die wir eingespart haben. Das waren 800.000 Schweizer Franken Einsparung pro Jahr. Ich muss keinem Roboter etwas neu beibringen, ich muss keinen Logistikmitarbeiter schulen, ich muss keiner Filiale etwas erklären. Ich muss nur mit Daten arbeiten und die Einsparungen einkassieren.",Steigerung Wertschöpfung,800'000 CHF Einsparungen 
12,Chief Operations Officer,Handelsunternehmen,Externe Firma,"In Bezug auf Kosteneinsparungspotential können wir ja mal die Kostenstruktur grundsätzlich durchgehen, so von einem Operationsbetrieb. Dann kommst du relativ schnell auf Personalkosten. Das sind meistens sehr hohe Aufwendungen. Und Personalkosten einsparen zu können bedeutet grundsätzlich, dass du Personal sauber planen kannst und dass du messen kannst, wie dein Personal im Einsatz ist. Also wo ist es effizient, wo ist es nicht effizient. Dort, wo es nicht effizient ist, wo unterstützt es die Qualität oder wo ist es schlicht einfach Verschwendung oder Leerlauf. Und da hast du einerseits aus dem Planungscycle heraus den Bedarf, besser forcasten zu können. Und Forecasting ist eigentlich immer Data Crunching und Prognose ist immer prädestiniert, um mit Algorithmen oder mit KI-Systemen zu arbeiten.",Reduktion Personalaufwand,-
12,Chief Operations Officer,Handelsunternehmen,Externe Firma,"Sobald du Managemententscheidungen treffen willst und Personaleinsatzplanung, das ist ein Managemententscheid, ist ja die Frage, wie kann das Management die Situation begreifen. Und das ist eine Frage der Datenaufbereitung und Darstellung. Und wenn du Schichtmodelle, Personalkörper, Fähigkeiten von Personal gut darstellen kannst oder allenfalls dann sogar über Algorithmen, weil du saubere Daten hast, optimieren kannst. Also du hast die ideale Belegschaft auf Basis der Fähigkeiten, der Einsatzbereitschaft, der Schichtzeiten, des prognostizierten Volumens, dann hast du wieder Savings.",Steigerung Wertschöpfung,-
12,Chief Operations Officer,Handelsunternehmen,Externe Firma,"In Bezug auf Kundeninteraktionen im Kundendienst, wenn der Kunde super viel Zeit bekommt von deinem Mitarbeiter, dann ist das vielleicht super und die sind alle super happy, aber du verlierst Geld. Und über aktuelle LLM-Modelle kannst du ja die Sprache des Kunden verstehen, du kannst seinen Temper verstehen, du kannst messen den Delta zwischen Anfangszustand und Endzustand oder Zwischenzustände und du kannst eigentlich optimieren, wie, ab welchem Zeitpunkt lohnt es sich, noch am Telefon zu bleiben und ab welchem Zeitpunkt sagst du dem Kunden, du hängst quasi auf, weil du kannst eh nichts mehr gewinnen oder gehst du in einen Gesprächsbeendungsmodus, weil du merkst, der Kunde ist jetzt eigentlich zufrieden. Auch das sind Use Cases, die du anwenden kannst, um die Hard Savings zu gewinnen",Steigerung Wertschöpfung,-
33,Director Data Strategy,Beratungsfirma,Beratung,"Or they don't find it because it's too hidden, the data, and they create the same data set one more time, then you're going to have an additional cost complexity problem, right? So, then you're running like a shadow data center. So, those are the usual problems scaled up on an organizational level.",Kosten durch Komplexität,-
33,Director Data Strategy,Beratungsfirma,Beratung,"Yeah, the number we say is you can reduce your time to find data by 50 to 80%, as we usually say. But that's only based on the sample of our projects that we have, right? So it's never gonna be like a really full estimate that's very well organized.",Reduktion Aufwand ,50 - 80%
,,,,,,